{
  "$schema": "https://json-schema.org/draft/2020-12/schema",
  "$id": "https://github.com/robert-mcdermott/mavescape/docs/schemas/design.v1.json",
  "title": "MaveScape experiment design, version 1",
  "description": "What each column of a count table is: samples, their roles, conditions and replicates, times or bins, tiles, targets, controls and what the assay measures. Structural rules are here; the rules that depend on the model (two-population, time-series, bins, scores) and on the table are checked by validateDesign in web/lib/design.js. See mavescape-spec/conventions.md, 'Design'.",
  "type": "object",
  "required": ["format", "version", "model", "targets", "variants", "samples", "replicates"],
  "additionalProperties": false,
  "properties": {
    "format": { "const": "mavescape-design" },
    "version": { "const": 1 },
    "name": { "type": "string" },
    "description": { "type": "string" },
    "model": {
      "description": "two-population: input and output of a selection; time-series: the same library sampled at two or more times; bins: cells sorted into ordered bins; scores: a table of precomputed scores (no counts).",
      "enum": ["two-population", "time-series", "bins", "scores"]
    },
    "readout": {
      "description": "What the assay measures (MaveScape 0.2). The method, mechanism and model system are MaveDB's controlled keywords for an experiment (the MAVE minimum information's vocabulary, Claussnitzer et al. 2024). Until the direction is stated, MaveScape takes a higher score to mean more of the function measured, and says so.",
      "type": "object",
      "additionalProperties": false,
      "properties": {
        "phenotype": { "type": "string", "description": "What was measured, in words (\"cellular abundance of the domain\")." },
        "method": { "type": "string", "description": "MaveDB's Phenotypic Assay Method (Reporter, Cell fitness, Binding assay…)." },
        "mechanism": { "type": "string", "description": "MaveDB's Phenotypic Assay Mechanism: the variants the assay detects (Loss of function, Gain of function…)." },
        "modelSystem": { "type": "string", "description": "MaveDB's Phenotypic Assay Model System (Yeast, Immortalized human cells…)." },
        "direction": { "enum": ["higher-more", "higher-less", "unsigned"], "description": "What a higher score means: more of the function measured, less of it, or a larger change either way (no sign)." }
      }
    },
    "source": {
      "description": "Where the table came from, when it is public.",
      "type": "object",
      "additionalProperties": false,
      "properties": {
        "mavedb": { "type": "string", "pattern": "^urn:mavedb:[0-9]{8}-[a-z0-9]+-[0-9]+$" },
        "citation": { "type": "string" },
        "license": { "type": "string" }
      }
    },
    "variants": {
      "description": "The column naming each row's variant, and the level of its names.",
      "type": "object",
      "required": ["column", "level"],
      "additionalProperties": false,
      "properties": {
        "column": { "type": "string", "minLength": 1 },
        "level": { "enum": ["nucleotide", "splice", "protein"] }
      }
    },
    "targets": {
      "type": "array",
      "minItems": 1,
      "items": { "$ref": "#/$defs/target" }
    },
    "library": {
      "type": "object",
      "additionalProperties": false,
      "properties": {
        "level": { "enum": ["variant", "barcode"], "description": "variant: one row per variant; barcode: one row per barcode, each naming the variant it carries (many barcodes per variant)." },
        "barcodeColumn": { "type": "string", "minLength": 1, "description": "For a table of barcodes: the column of barcode identifiers (each on one row)." },
        "method": { "type": "string", "minLength": 1, "description": "How the library was made, in MaveDB's terms (In Vitro Construct Library Method System: Error-prone PCR, Doped oligo synthesis, Oligo pool synthesis…). Libraries made by error-prone PCR or doped oligos reach mostly the substitutions one nucleotide change makes, and coverage is judged against those (MaveScape 0.2)." },
        "tiles": { "type": "array", "items": { "$ref": "#/$defs/tile" } }
      }
    },
    "conditions": {
      "type": "array",
      "items": {
        "type": "object",
        "required": ["id", "name"],
        "additionalProperties": false,
        "properties": {
          "id": { "$ref": "#/$defs/id" },
          "name": { "type": "string", "minLength": 1 },
          "reference": { "type": "boolean" },
          "description": { "type": "string" }
        }
      }
    },
    "samples": {
      "description": "Physical sequenced samples. A sample's columns are its technical replicates, summed before scoring. A sample may be shared by several replicates (one input library selected three times).",
      "type": "array",
      "items": { "$ref": "#/$defs/sample" }
    },
    "replicates": {
      "description": "Biological replicates (Enrich2's selections): each scored on its own, then combined.",
      "type": "array",
      "items": { "$ref": "#/$defs/replicate" }
    },
    "time": {
      "type": "object",
      "required": ["unit"],
      "additionalProperties": false,
      "properties": { "unit": { "enum": ["round", "generation", "hour", "day", "minute", "other"] } }
    },
    "bins": {
      "type": "object",
      "required": ["weight"],
      "additionalProperties": false,
      "properties": {
        "weight": {
          "description": "What a bin's value means: its rank (1, 2, 3…, or the VAMP-seq weights 0.25–1), a fluorescence, or another measure.",
          "enum": ["rank", "fluorescence", "other"]
        }
      }
    },
    "scores": {
      "description": "For model 'scores': the columns that hold scores and their uncertainty.",
      "type": "object",
      "required": ["score"],
      "additionalProperties": false,
      "properties": {
        "score": { "type": "string" },
        "se": { "type": "string" },
        "ciLow": { "type": "string" },
        "ciHigh": { "type": "string" }
      }
    },
    "controls": {
      "type": "object",
      "additionalProperties": false,
      "properties": {
        "wildType": { "type": "string", "description": "'auto' (p.=, c.=, _wt) or the identifier of the wild-type row" },
        "synonymous": { "anyOf": [{ "const": "auto" }, { "const": "none" }, { "type": "array", "items": { "type": "string" } }] },
        "nonsense": { "anyOf": [{ "const": "auto" }, { "const": "none" }, { "type": "array", "items": { "type": "string" } }] },
        "classes": {
          "type": "array",
          "items": {
            "type": "object",
            "required": ["name", "variants"],
            "additionalProperties": false,
            "properties": {
              "name": { "type": "string" },
              "variants": { "type": "array", "items": { "type": "string" } },
              "source": { "type": "string" }
            }
          }
        },
        "positions": {
          "description": "Where a class serves as a control, in target positions (MaveScape 0.2): nonsense variants are loss-of-function controls only where a stop loses the function assayed.",
          "type": "object",
          "additionalProperties": false,
          "properties": {
            "synonymous": { "$ref": "#/$defs/range" },
            "nonsense": { "$ref": "#/$defs/range" }
          }
        },
        "why": {
          "description": "Why each class is a control in this assay, in words (MaveScape 0.2).",
          "type": "object",
          "additionalProperties": false,
          "properties": { "wildType": { "type": "string" }, "synonymous": { "type": "string" }, "nonsense": { "type": "string" } }
        }
      }
    },
    "ignoredColumns": {
      "description": "Columns of the table this design does not use, each with the reason, so no column is dropped silently.",
      "type": "array",
      "items": {
        "type": "object",
        "required": ["column", "reason"],
        "additionalProperties": false,
        "properties": {
          "column": { "type": "string" },
          "reason": { "type": "string", "minLength": 1 },
          "copyOf": { "type": "string", "description": "This column repeats another column's values (a shared sample written once per replicate)." }
        }
      }
    },
    "notes": { "type": "array", "items": { "type": "string" } }
  },
  "$defs": {
    "id": { "type": "string", "pattern": "^[A-Za-z0-9_.-]{1,64}$" },
    "range": {
      "type": "object",
      "additionalProperties": false,
      "properties": { "start": { "type": "integer", "minimum": 1 }, "end": { "type": "integer", "minimum": 1 } }
    },
    "target": {
      "type": "object",
      "required": ["id", "name", "sequenceType", "sequence"],
      "additionalProperties": false,
      "properties": {
        "id": { "$ref": "#/$defs/id" },
        "name": { "type": "string", "minLength": 1 },
        "label": { "type": "string", "minLength": 1, "description": "The name variant names give the target when it is not its id, name or an accession (MaveDB's label in a score set of several targets: LMNA:n.127G>A)." },
        "sequenceType": { "enum": ["dna", "protein"] },
        "sequence": { "type": "string", "minLength": 1 },
        "codingStart": { "type": "integer", "minimum": 1, "description": "DNA targets: the first base of the reading frame (1-based)." },
        "offset": { "type": "integer", "description": "Added to target positions to give positions in the reference protein (UniProt numbering)." },
        "organism": { "type": "string" },
        "taxonomyId": { "type": "integer", "minimum": 1, "description": "The organism's NCBI Taxonomy id (9606 for Homo sapiens), as MaveDB keeps it with a target sequence." },
        "identifiers": {
          "type": "object",
          "additionalProperties": false,
          "properties": {
            "uniprot": { "type": "string" },
            "refseq": { "type": "string" },
            "genbank": { "type": "string", "description": "An INSDC (GenBank, ENA, DDBJ) nucleotide accession, such as a plasmid's." },
            "protein": { "type": "string", "description": "The protein's RefSeq or Ensembl accession (NP_009225.1, ENSP00000269305.4), as protein variant names may be prefixed." },
            "ensembl": { "type": "string" },
            "gene": { "type": "string" }
          }
        },
        "differences": {
          "description": "Known differences between the target and the reference (construct changes), so they are not reported as errors.",
          "type": "array",
          "items": {
            "type": "object",
            "required": ["position", "target", "reference"],
            "additionalProperties": false,
            "properties": {
              "position": { "type": "integer", "minimum": 1 },
              "target": { "type": "string" },
              "reference": { "type": "string" },
              "note": { "type": "string" }
            }
          }
        }
      }
    },
    "tile": {
      "type": "object",
      "required": ["id", "start", "end"],
      "additionalProperties": false,
      "properties": {
        "id": { "$ref": "#/$defs/id" },
        "name": { "type": "string" },
        "start": { "type": "integer", "minimum": 1 },
        "end": { "type": "integer", "minimum": 1 }
      }
    },
    "sample": {
      "type": "object",
      "required": ["id", "columns"],
      "additionalProperties": false,
      "properties": {
        "id": { "$ref": "#/$defs/id" },
        "name": { "type": "string" },
        "columns": { "type": "array", "minItems": 1, "items": { "type": "string", "minLength": 1 } },
        "batch": { "type": "string" },
        "cells": { "type": "number", "minimum": 0, "description": "Cells, when known: sorted into this bin; carried into selection from this input; recovered after selection in this output (MaveScape 0.2: quality control checks the bottleneck it infers against them)." },
        "missingMeansZero": { "type": "boolean", "description": "Read this sample's missing counts as 0: for tables that write variants that dropped out during selection as missing rather than 0 (MaveScape 0.2)." },
        "notes": { "type": "string" }
      }
    },
    "replicate": {
      "type": "object",
      "required": ["id", "biological"],
      "additionalProperties": false,
      "properties": {
        "id": { "$ref": "#/$defs/id" },
        "name": { "type": "string" },
        "condition": { "$ref": "#/$defs/id" },
        "biological": { "type": "integer", "minimum": 1 },
        "tile": { "$ref": "#/$defs/id" },
        "input": { "$ref": "#/$defs/id" },
        "output": { "$ref": "#/$defs/id" },
        "timepoints": {
          "type": "array",
          "items": {
            "type": "object",
            "required": ["sample", "time"],
            "additionalProperties": false,
            "properties": { "sample": { "$ref": "#/$defs/id" }, "time": { "type": "number", "minimum": 0 } }
          }
        },
        "bins": {
          "type": "array",
          "items": {
            "type": "object",
            "required": ["sample", "order", "value"],
            "additionalProperties": false,
            "properties": {
              "sample": { "$ref": "#/$defs/id" },
              "order": { "type": "integer", "minimum": 1 },
              "value": { "type": "number" },
              "lower": { "type": "number", "exclusiveMinimum": 0, "description": "The bin's lower gate on the reporter (fluorescence, linear units); none for the lowest bin (open). With upper, for the maximum-likelihood estimate (MaveScape 0.2)." },
              "upper": { "type": "number", "exclusiveMinimum": 0, "description": "The bin's upper gate; none for the highest bin (open)." }
            }
          }
        }
      }
    }
  }
}
