{
  "format": "mavescape-design",
  "version": 1,
  "name": "Synthetic barcode fixture (simulated)",
  "description": "Simulated by MaveScape (web/lib/simulate.js, seed 20261012): not real data. 2 libraries (replicates) of barcoded codon variants, 3.5 barcodes per variant on average, 100 reads per barcode; 2.0% of barcodes off from their variant, 1.5% given two variants by the map and 1.0% missing from it.",
  "model": "two-population",
  "variants": {
    "column": "hgvs_pro",
    "level": "protein"
  },
  "targets": [
    {
      "id": "simulated",
      "name": "Simulated gene",
      "sequenceType": "dna",
      "sequence": "ATGTCTAAAGGTGAAGAACTGTTTACCGGTGTTGTTCCGATTCTGGTTGAACTGGATGGTGATGTTAATGGTCATAAATTTTCTGTTTCT"
    }
  ],
  "library": {
    "level": "barcode",
    "barcodeColumn": "barcode"
  },
  "samples": [
    {
      "id": "pre_rep1",
      "name": "pre_rep1",
      "columns": [
        "pre_rep1"
      ]
    },
    {
      "id": "post_rep1",
      "name": "post_rep1",
      "columns": [
        "post_rep1"
      ]
    },
    {
      "id": "pre_rep2",
      "name": "pre_rep2",
      "columns": [
        "pre_rep2"
      ]
    },
    {
      "id": "post_rep2",
      "name": "post_rep2",
      "columns": [
        "post_rep2"
      ]
    }
  ],
  "replicates": [
    {
      "id": "rep1",
      "name": "Replicate 1",
      "biological": 1,
      "input": "pre_rep1",
      "output": "post_rep1"
    },
    {
      "id": "rep2",
      "name": "Replicate 2",
      "biological": 2,
      "input": "pre_rep2",
      "output": "post_rep2"
    }
  ],
  "controls": {
    "wildType": "p.=",
    "synonymous": "auto",
    "nonsense": "auto"
  }
}
